注册REG
IPEnableRouter.reg

开启服务 services.msc
Routing and Remote Acess服务

log:
1892	5.434105	192.222.8.159	8888	192.222.0.66	8888	UDP	98	以太网 2	8888 → 8888 Len=56
1893	5.435736	192.222.0.66	8888	192.222.8.159	8888	UDP	90	以太网 2	8888 → 8888 Len=48
1899	5.434950	10.1.0.10	25567	10.1.0.20	8080	TCP	56	tun	25567 → 8080 [SYN] Seq=0 Win=27200 Len=0 MSS=1360 SACK_PERM TSval=213811268 TSecr=0
1900	5.435091	10.1.0.20	8080	10.1.0.10	25567	TCP	48	tun	8080 → 25567 [SYN, ACK] Seq=0 Ack=1 Win=65280 Len=0 MSS=1360 SACK_PERM
1901	5.438386	10.1.0.10	25567	10.1.0.20	8080	TCP	40	tun	25567 → 8080 [ACK] Seq=1 Ack=1 Win=27200 Len=0
1903	5.439942	10.1.0.20	8080	10.1.0.10	25567	TCP	53	tun	8080 → 25567 [PSH, ACK] Seq=1 Ack=1 Win=65280 Len=13
1904	5.445741	10.1.0.10	25567	10.1.0.20	8080	TCP	40	tun	25567 → 8080 [ACK] Seq=1 Ack=14 Win=27200 Len=0
1924	5.437860	192.222.8.159	8888	192.222.0.66	8888	UDP	82	以太网 2	8888 → 8888 Len=40
1930	5.440702	192.222.0.66	8888	192.222.8.159	8888	UDP	95	以太网 2	8888 → 8888 Len=53
1933	5.442665	192.222.8.159	8888	192.222.0.66	8888	UDP	82	以太网 2	8888 → 8888 Len=40
